{
  "code": "C81",
  "revision": 3,
  "name": {
    "zh": "撕纸拼贴",
    "en": "Torn-Paper Collage"
  },
  "family": "封面与海报",
  "fit": [
    "讲道理",
    "封面"
  ],
  "facets": {
    "medium": "撕纸拼贴",
    "density": "极简留白"
  },
  "visibility": "public",
  "source": {
    "from": "original",
    "license": "original",
    "notes": "2026-10-01 按封面与风格调研新增：吸收成熟做法（含 baoyu-skills，MIT，仅取思路），自行撰写配方；基础可调用版，尚未通过准入。"
  },
  "essence": [
    "撕边纸片与半色调剪影",
    "手写批注与胶带",
    "黑、奶油加一个热色点缀"
  ],
  "recipe": {
    "positive": "Visual style (follow exactly): Torn-paper collage: ripped paper edges, halftone cut-out silhouettes, strips of tape, mismatched paper textures, a limited palette of black, cream and one hot accent colour, layered and slightly edgy composition with a clear focal piece.",
    "optional_text_roles": [
      "note"
    ],
    "role_styles": {
      "note": "Each marginal note is a short hand-written annotation in the margin of a paper fragment, made of exactly the given characters."
    },
    "text_mode": [
      "native",
      "none"
    ]
  },
  "palette": {
    "recolor": "free"
  },
  "qa": {
    "must_see": [
      "撕边纸片与半色调剪影",
      "胶带与错位的纸张质感",
      "黑、奶油加一个热色点缀"
    ],
    "must_not_see": [
      "光滑数码渐变",
      "整齐对称的版式",
      "未请求的文字或水印"
    ]
  },
  "evidence": {
    "admission": "pending",
    "model": "尚未实测",
    "date": "2026-10-01",
    "notes": "新增风格，仅完成合同校验；样图见按用途样图。"
  },
  "changelog": [
    {
      "revision": 1,
      "date": "2026-10-01",
      "note": "新增：风格调研后吸收，准入待验证"
    },
    {
      "revision": 2,
      "date": "2026-10-02",
      "note": "加入叁笙自制的无人物风格参考板作为画风锚点（色板、材质、母题、构图），出图时自动当画风参考；不含人物与动物，避免内容串入。"
    },
    {
      "revision": 3,
      "date": "2026-10-13",
      "note": "文字声明化：手写批注改为可选角色 note（给了才画，进入逐字文字清单）；配方正文不再自带文字，避免与「只出清单里的文字」冲突。"
    }
  ],
  "inspiration": {
    "names": [
      "杂志撕纸拼贴"
    ],
    "prompt": "杂志撕纸拼贴"
  },
  "uses": [
    "封面",
    "小红书",
    "文章插图"
  ],
  "renderer": "codex",
  "samples": [
    {
      "topic": "风格参考板",
      "file": "samples/bd.webp",
      "renderer": "codex-builtin",
      "date": "2026-10-02",
      "ratio": 1.776
    },
    {
      "topic": "公众号封面",
      "file": "samples/cv.webp",
      "renderer": "codex-builtin",
      "date": "2026-10-02",
      "ratio": 2.35
    },
    {
      "topic": "横版插图 第 1 张",
      "file": "samples/wxi.webp",
      "renderer": "codex-builtin",
      "date": "2026-10-02",
      "ratio": 1.776
    },
    {
      "topic": "横版插图 第 2 张",
      "file": "samples/wxi-2.webp",
      "renderer": "codex-builtin",
      "date": "2026-10-02",
      "ratio": 1.776
    },
    {
      "topic": "横版插图 第 3 张",
      "file": "samples/wxi-3.webp",
      "renderer": "codex-builtin",
      "date": "2026-10-02",
      "ratio": 1.776
    },
    {
      "topic": "竖版插图 第 1 张",
      "file": "samples/wxt.webp",
      "renderer": "codex-builtin",
      "date": "2026-10-02",
      "ratio": 0.562
    },
    {
      "topic": "竖版插图 第 2 张",
      "file": "samples/wxt-2.webp",
      "renderer": "codex-builtin",
      "date": "2026-10-02",
      "ratio": 0.562
    },
    {
      "topic": "推特单图",
      "file": "samples/wxx.webp",
      "renderer": "codex-builtin",
      "date": "2026-10-02",
      "ratio": 1.776
    },
    {
      "topic": "小红书 第 1 张",
      "file": "samples/xhs.webp",
      "renderer": "codex-builtin",
      "date": "2026-10-02",
      "ratio": 0.75
    },
    {
      "topic": "小红书 第 2 张",
      "file": "samples/xhs-2.webp",
      "renderer": "codex-builtin",
      "date": "2026-10-02",
      "ratio": 0.75
    },
    {
      "topic": "小红书 第 3 张",
      "file": "samples/xhs-3.webp",
      "renderer": "codex-builtin",
      "date": "2026-10-02",
      "ratio": 0.75
    },
    {
      "topic": "小红书 第 4 张",
      "file": "samples/xhs-4.webp",
      "renderer": "codex-builtin",
      "date": "2026-10-02",
      "ratio": 0.75
    },
    {
      "topic": "小红书 第 5 张",
      "file": "samples/xhs-5.webp",
      "renderer": "codex-builtin",
      "date": "2026-10-02",
      "ratio": 0.75
    },
    {
      "topic": "小红书 第 6 张",
      "file": "samples/xhs-6.webp",
      "renderer": "codex-builtin",
      "date": "2026-10-02",
      "ratio": 0.75
    },
    {
      "topic": "换色示例·原色",
      "file": "samples/pc-orig.webp",
      "renderer": "codex-builtin",
      "date": "2026-10-05",
      "ratio": 0.75
    },
    {
      "topic": "换色示例·桃粉奶霜",
      "file": "samples/pc-macaron.webp",
      "renderer": "codex-builtin",
      "date": "2026-10-05",
      "ratio": 0.75
    },
    {
      "topic": "换色示例·焦糖亚麻",
      "file": "samples/pc-earth.webp",
      "renderer": "codex-builtin",
      "date": "2026-10-05",
      "ratio": 0.75
    },
    {
      "topic": "换色示例·雾灰燕麦",
      "file": "samples/pc-morandi.webp",
      "renderer": "codex-builtin",
      "date": "2026-10-05",
      "ratio": 0.75
    },
    {
      "topic": "换色示例·松林晨雾",
      "file": "samples/pc-forest.webp",
      "renderer": "codex-builtin",
      "date": "2026-10-05",
      "ratio": 0.75
    },
    {
      "topic": "换色示例·海盐浅湾",
      "file": "samples/pc-ocean.webp",
      "renderer": "codex-builtin",
      "date": "2026-10-05",
      "ratio": 0.75
    },
    {
      "topic": "换色示例·旧照暖阳",
      "file": "samples/pc-film.webp",
      "renderer": "codex-builtin",
      "date": "2026-10-05",
      "ratio": 0.75
    },
    {
      "topic": "换色示例·千里青绿",
      "file": "samples/pc-qinglv.webp",
      "renderer": "codex-builtin",
      "date": "2026-10-05",
      "ratio": 0.75
    },
    {
      "topic": "换色示例·朱砂泥金",
      "file": "samples/pc-zhusha.webp",
      "renderer": "codex-builtin",
      "date": "2026-10-05",
      "ratio": 0.75
    },
    {
      "topic": "换色示例·一墨单色",
      "file": "samples/pc-mono.webp",
      "renderer": "codex-builtin",
      "date": "2026-10-05",
      "ratio": 0.75
    },
    {
      "topic": "换色示例·午夜霓虹",
      "file": "samples/pc-neon.webp",
      "renderer": "codex-builtin",
      "date": "2026-10-05",
      "ratio": 0.75
    },
    {
      "topic": "换色示例·日落暖城",
      "file": "samples/pc-sunset.webp",
      "renderer": "codex-builtin",
      "date": "2026-10-05",
      "ratio": 0.75
    },
    {
      "topic": "换色示例·奶油咖啡",
      "file": "samples/pc-creamcoffee.webp",
      "renderer": "codex-builtin",
      "date": "2026-10-05",
      "ratio": 0.75
    },
    {
      "topic": "换色示例·薄荷苏打",
      "file": "samples/pc-mintsoda.webp",
      "renderer": "codex-builtin",
      "date": "2026-10-05",
      "ratio": 0.75
    },
    {
      "topic": "换色示例·湖面晨雾",
      "file": "samples/pc-mistblue.webp",
      "renderer": "codex-builtin",
      "date": "2026-10-05",
      "ratio": 0.75
    },
    {
      "topic": "换色示例·樱花和纸",
      "file": "samples/pc-sakura.webp",
      "renderer": "codex-builtin",
      "date": "2026-10-05",
      "ratio": 0.75
    },
    {
      "topic": "换色示例·靛蓝夜航",
      "file": "samples/pc-indigo.webp",
      "renderer": "codex-builtin",
      "date": "2026-10-05",
      "ratio": 0.75
    },
    {
      "topic": "换色示例·琥珀秋叶",
      "file": "samples/pc-amber.webp",
      "renderer": "codex-builtin",
      "date": "2026-10-05",
      "ratio": 0.75
    },
    {
      "topic": "换色示例·紫藤薄暮",
      "file": "samples/pc-lilac.webp",
      "renderer": "codex-builtin",
      "date": "2026-10-05",
      "ratio": 0.75
    }
  ],
  "anchor": {
    "file": "anchor.png",
    "sha256": "c94f3194483a3d10e05225c641b3563e4d87d5c54bd77320e51424863a9a02d0",
    "enabled": true,
    "isolation": "This image is a style reference sheet for this visual style. Transfer only its rendering technique, line or brush character, material, texture, colour tendency and decorative language. Never copy the sheet's layout, panels, swatches, labels, words, objects or composition; all subjects, layout and text come exclusively from the current brief."
  }
}
