{
  "code": "C49",
  "revision": 4,
  "name": {
    "zh": "条漫厚涂",
    "en": "Painterly Webtoon"
  },
  "family": "漫画与分镜",
  "fit": [
    "讲故事"
  ],
  "facets": {
    "medium": "条漫厚涂",
    "density": "中等"
  },
  "visibility": "public",
  "source": {
    "from": "original",
    "license": "original",
    "notes": "基于 2026-09-25 同题三题提示词的共同风格段整理；基础可调用版，尚未通过准入。"
  },
  "essence": [
    "清晰人物线与柔和厚涂赛璐璐明暗",
    "发光肤色与有表情的眼睛",
    "电影感轮廓光和纵向叙事"
  ],
  "recipe": {
    "positive": "Visual style (follow exactly): in the style of Korean webtoon semi-painterly digital style. Webtoon painterly style: clean character line art with soft painterly cel shading, luminous skin, glossy expressive eyes, cinematic rim light, polished modern Korean/Chinese web-comic look, vivid but soft colours.",
    "text_mode": [
      "native",
      "overlay",
      "none"
    ]
  },
  "palette": {
    "recolor": "free"
  },
  "qa": {
    "must_see": [
      "清晰人物线与柔和厚涂赛璐璐明暗",
      "发光肤色与有表情的眼睛",
      "电影感轮廓光和纵向叙事"
    ],
    "must_not_see": [
      "粗糙速写或完全平涂色块",
      "未请求的文字或水印"
    ]
  },
  "evidence": {
    "admission": "pending",
    "model": "未在基础合同上完成模型实测",
    "date": "2026-09-30",
    "notes": "配方加入原作名并换用原作样图（或取消自产锚点）；仅完成合同校验与同题试出图，尚未通过正式准入。"
  },
  "changelog": [
    {
      "revision": 1,
      "date": "2026-09-29",
      "note": "从同题提示词整理基础可调用合同；准入待验证"
    },
    {
      "revision": 2,
      "date": "2026-09-29",
      "note": "加入同题原图的画风锚点；只引用画法并隔离参考图内容，正式准入仍待验证"
    },
    {
      "revision": 3,
      "date": "2026-09-30",
      "note": "画风库 v2：配方加入原作名；旧自产锚点退役（移入 legacy/），改用 MIT 原作样图或不配锚点；新增用途、渲染器与同题样图。"
    },
    {
      "revision": 4,
      "date": "2026-10-02",
      "note": "加入叁笙自制的无人物风格参考板作为画风锚点（色板、材质、母题、构图），出图时自动当画风参考；不含人物与动物，避免内容串入。"
    }
  ],
  "inspiration": {
    "names": [
      "韩国网络条漫"
    ],
    "prompt": "Korean webtoon semi-painterly digital style"
  },
  "uses": [
    "封面",
    "小红书",
    "漫画",
    "分镜"
  ],
  "renderer": "codex",
  "samples": [
    {
      "topic": "人物",
      "file": "samples/s1.jpg",
      "source_sha256": "559c4a93f4b10b1ef2bd9ea8b76844b28821b589bc6a9b28fc06b584b8587de6",
      "renderer": "codex-builtin",
      "date": "2026-09-30",
      "ratio": 1.0
    },
    {
      "topic": "物件",
      "file": "samples/s2.jpg",
      "source_sha256": "1d43f1be40c7560a0407407ae2ae3e07d1ef4111d61adfd34a5d5dd34f61c056",
      "renderer": "codex-builtin",
      "date": "2026-09-30",
      "ratio": 1.0
    },
    {
      "topic": "信息图（简）",
      "file": "samples/s3.webp",
      "renderer": "codex-builtin",
      "date": "2026-10-01",
      "ratio": 0.75
    },
    {
      "topic": "风格参考板",
      "file": "samples/bd.webp",
      "renderer": "codex-builtin",
      "date": "2026-10-02",
      "ratio": 1.776
    },
    {
      "topic": "公众号封面",
      "file": "samples/cv.webp",
      "renderer": "codex-builtin",
      "date": "2026-10-02",
      "ratio": 2.35
    },
    {
      "topic": "公众号封面（展台高清版，依原图高清重绘）",
      "file": "samples/cv-hd.webp",
      "source_sha256": "af14d06fb3e4d39ba21b1af3f1254d4f4f3545ebb2c43dd7005e2b46d47d07c3",
      "renderer": "codex-builtin",
      "date": "2026-10-13",
      "ratio": 2.351
    },
    {
      "topic": "小红书 第 1 张",
      "file": "samples/xhs.webp",
      "renderer": "codex-builtin",
      "date": "2026-10-02",
      "ratio": 0.75
    },
    {
      "topic": "小红书 第 2 张",
      "file": "samples/xhs-2.webp",
      "renderer": "codex-builtin",
      "date": "2026-10-02",
      "ratio": 0.75
    },
    {
      "topic": "小红书 第 3 张",
      "file": "samples/xhs-3.webp",
      "renderer": "codex-builtin",
      "date": "2026-10-02",
      "ratio": 0.75
    },
    {
      "topic": "小红书 第 4 张",
      "file": "samples/xhs-4.webp",
      "renderer": "codex-builtin",
      "date": "2026-10-02",
      "ratio": 0.75
    },
    {
      "topic": "小红书 第 5 张",
      "file": "samples/xhs-5.webp",
      "renderer": "codex-builtin",
      "date": "2026-10-02",
      "ratio": 0.75
    },
    {
      "topic": "小红书 第 6 张",
      "file": "samples/xhs-6.webp",
      "renderer": "codex-builtin",
      "date": "2026-10-02",
      "ratio": 0.75
    },
    {
      "topic": "日漫混排页",
      "file": "samples/cx.webp",
      "renderer": "codex-builtin",
      "date": "2026-10-02",
      "ratio": 0.75
    },
    {
      "topic": "色系·午夜霓虹·人物场景",
      "file": "samples/pl-neon.webp",
      "renderer": "codex-builtin",
      "date": "2026-10-05",
      "ratio": 0.75
    },
    {
      "topic": "AI 短剧分镜·角色三视图",
      "file": "samples/sb.webp",
      "renderer": "codex-builtin",
      "date": "2026-10-05",
      "ratio": 1.776
    },
    {
      "topic": "AI 短剧分镜·竖屏镜头 1",
      "file": "samples/sb-2.webp",
      "renderer": "codex-builtin",
      "date": "2026-10-05",
      "ratio": 0.563
    },
    {
      "topic": "AI 短剧分镜·竖屏镜头 2",
      "file": "samples/sb-3.webp",
      "renderer": "codex-builtin",
      "date": "2026-10-05",
      "ratio": 0.563
    },
    {
      "topic": "AI 短剧分镜·横屏电影感",
      "file": "samples/sb-4.webp",
      "renderer": "codex-builtin",
      "date": "2026-10-05",
      "ratio": 1.776
    },
    {
      "topic": "换色示例·原色",
      "file": "samples/pc-orig.webp",
      "renderer": "codex-builtin",
      "date": "2026-10-05",
      "ratio": 1.0
    },
    {
      "topic": "换色示例·桃粉奶霜",
      "file": "samples/pc-macaron.webp",
      "renderer": "codex-builtin",
      "date": "2026-10-05",
      "ratio": 0.75
    },
    {
      "topic": "换色示例·焦糖亚麻",
      "file": "samples/pc-earth.webp",
      "renderer": "codex-builtin",
      "date": "2026-10-05",
      "ratio": 0.75
    },
    {
      "topic": "换色示例·雾灰燕麦",
      "file": "samples/pc-morandi.webp",
      "renderer": "codex-builtin",
      "date": "2026-10-05",
      "ratio": 0.75
    },
    {
      "topic": "换色示例·松林晨雾",
      "file": "samples/pc-forest.webp",
      "renderer": "codex-builtin",
      "date": "2026-10-05",
      "ratio": 0.75
    },
    {
      "topic": "换色示例·海盐浅湾",
      "file": "samples/pc-ocean.webp",
      "renderer": "codex-builtin",
      "date": "2026-10-05",
      "ratio": 0.75
    },
    {
      "topic": "换色示例·旧照暖阳",
      "file": "samples/pc-film.webp",
      "renderer": "codex-builtin",
      "date": "2026-10-05",
      "ratio": 0.75
    },
    {
      "topic": "换色示例·千里青绿",
      "file": "samples/pc-qinglv.webp",
      "renderer": "codex-builtin",
      "date": "2026-10-05",
      "ratio": 0.75
    },
    {
      "topic": "换色示例·朱砂泥金",
      "file": "samples/pc-zhusha.webp",
      "renderer": "codex-builtin",
      "date": "2026-10-05",
      "ratio": 0.75
    },
    {
      "topic": "换色示例·一墨单色",
      "file": "samples/pc-mono.webp",
      "renderer": "codex-builtin",
      "date": "2026-10-05",
      "ratio": 0.75
    },
    {
      "topic": "换色示例·午夜霓虹",
      "file": "samples/pc-neon.webp",
      "renderer": "codex-builtin",
      "date": "2026-10-05",
      "ratio": 0.75
    },
    {
      "topic": "换色示例·日落暖城",
      "file": "samples/pc-sunset.webp",
      "renderer": "codex-builtin",
      "date": "2026-10-05",
      "ratio": 0.75
    },
    {
      "topic": "换色示例·奶油咖啡",
      "file": "samples/pc-creamcoffee.webp",
      "renderer": "codex-builtin",
      "date": "2026-10-05",
      "ratio": 0.75
    },
    {
      "topic": "换色示例·薄荷苏打",
      "file": "samples/pc-mintsoda.webp",
      "renderer": "codex-builtin",
      "date": "2026-10-05",
      "ratio": 0.75
    },
    {
      "topic": "换色示例·湖面晨雾",
      "file": "samples/pc-mistblue.webp",
      "renderer": "codex-builtin",
      "date": "2026-10-05",
      "ratio": 0.75
    },
    {
      "topic": "换色示例·樱花和纸",
      "file": "samples/pc-sakura.webp",
      "renderer": "codex-builtin",
      "date": "2026-10-05",
      "ratio": 0.75
    },
    {
      "topic": "换色示例·靛蓝夜航",
      "file": "samples/pc-indigo.webp",
      "renderer": "codex-builtin",
      "date": "2026-10-05",
      "ratio": 0.75
    },
    {
      "topic": "换色示例·琥珀秋叶",
      "file": "samples/pc-amber.webp",
      "renderer": "codex-builtin",
      "date": "2026-10-05",
      "ratio": 0.75
    },
    {
      "topic": "换色示例·紫藤薄暮",
      "file": "samples/pc-lilac.webp",
      "renderer": "codex-builtin",
      "date": "2026-10-05",
      "ratio": 0.75
    }
  ],
  "anchor": {
    "file": "anchor.png",
    "sha256": "f902e38904430848a815e47b9a1c10c72aa1be06c9bc571661628c660a8d616a",
    "enabled": true,
    "isolation": "This image is a style reference sheet for this visual style. Transfer only its rendering technique, line or brush character, material, texture, colour tendency and decorative language. Never copy the sheet's layout, panels, swatches, labels, words, objects or composition; all subjects, layout and text come exclusively from the current brief."
  }
}
