{
  "code": "C19",
  "revision": 3,
  "name": {
    "zh": "新中式水墨小人",
    "en": "Modern Chinese Ink Miniatures"
  },
  "family": "中国风",
  "fit": [
    "封面",
    "讲故事"
  ],
  "facets": {
    "medium": "新中式水墨小人",
    "density": "中等"
  },
  "visibility": "public",
  "source": {
    "from": "handraw-style #192（描述已重写，不含人名）",
    "license": "MIT",
    "notes": "基于 2026-09-25 同题三题提示词的共同风格段整理；基础可调用版，尚未通过准入。"
  },
  "essence": [
    "大面积水墨留白",
    "广阔空间中的小人物",
    "一处小红色点睛"
  ],
  "recipe": {
    "positive": "Visual style (follow exactly): in the style of Laoshu Huahua (Liu Shuyong)'s modern Chinese ink-brush figures. New Chinese ink with tiny figures: large empty space, soft ink-wash diffusion and gradations, very small human figures in wide spaces, oriental poetic emotion, a single small red accent.",
    "text_mode": [
      "native",
      "overlay",
      "none"
    ]
  },
  "palette": {
    "recolor": "free"
  },
  "qa": {
    "must_see": [
      "大面积水墨留白",
      "广阔空间中的小人物",
      "一处小红色点睛"
    ],
    "must_not_see": [
      "人物特写或花哨多彩",
      "未请求的文字或水印"
    ]
  },
  "evidence": {
    "admission": "pending",
    "model": "未在基础合同上完成模型实测",
    "date": "2026-09-30",
    "notes": "配方加入原作名并换用原作样图（或取消自产锚点）；仅完成合同校验与同题试出图，尚未通过正式准入。"
  },
  "changelog": [
    {
      "revision": 1,
      "date": "2026-09-29",
      "note": "从同题提示词整理基础可调用合同；准入待验证"
    },
    {
      "revision": 2,
      "date": "2026-09-29",
      "note": "加入同题原图的画风锚点；只引用画法并隔离参考图内容，正式准入仍待验证"
    },
    {
      "revision": 3,
      "date": "2026-09-30",
      "note": "画风库 v2：配方加入原作名；旧自产锚点退役（移入 legacy/），改用 MIT 原作样图或不配锚点；新增用途、渲染器与同题样图。"
    }
  ],
  "anchor": {
    "file": "anchor.png",
    "sha256": "5a675914684a24fb18ace5aa8ff25766f609e225064157c5e26c1ac67b91edf6",
    "enabled": true,
    "isolation": "This image is only a visual-style sample. Transfer its rendering technique, line or brush character, material, texture, and colour tendency. All people, objects, pose, setting, composition, layout, and words must come exclusively from the current content brief; never reuse the reference image's story or subjects; hair colour, hairstyle, faces and clothing come only from the brief.",
    "origin": {
      "repo": "yang0/handraw-style",
      "item": "001-200/192",
      "license": "MIT",
      "url": "https://raw.githubusercontent.com/yang0/handraw-style/main/images/individual/001-200/192.webp"
    }
  },
  "inspiration": {
    "names": [
      "老树画画（刘树勇）"
    ],
    "prompt": "Laoshu Huahua (Liu Shuyong)'s modern Chinese ink-brush figures"
  },
  "uses": [
    "封面",
    "文章插图",
    "漫画",
    "绘本",
    "音乐封面"
  ],
  "renderer": "codex",
  "samples": [
    {
      "topic": "人物",
      "file": "samples/s1.jpg",
      "source_sha256": "fdd07469729b7165e846a80a43419e9630a2d00782e93fafc3680ca5dc328c16",
      "renderer": "codex-builtin",
      "date": "2026-09-30",
      "ratio": 1.0
    },
    {
      "topic": "物件",
      "file": "samples/s2.jpg",
      "source_sha256": "0856beda3041b36bfa1e792eb32f5756b1b3fe0e8d99c03eeebe14cddbca0b12",
      "renderer": "codex-builtin",
      "date": "2026-09-30",
      "ratio": 1.0
    },
    {
      "topic": "信息图",
      "file": "samples/s3.jpg",
      "source_sha256": "f7ed1264047e72b7b75d4789ed529504143e28805efc19ed1ebb46101e5b1679",
      "renderer": "codex-builtin",
      "date": "2026-09-30",
      "ratio": 1.0
    },
    {
      "topic": "风格参考板",
      "file": "samples/bd.webp",
      "renderer": "codex-builtin",
      "date": "2026-10-02",
      "ratio": 1.776
    },
    {
      "topic": "公众号封面",
      "file": "samples/cv.webp",
      "renderer": "codex-builtin",
      "date": "2026-10-02",
      "ratio": 2.35
    },
    {
      "topic": "公众号封面（展台高清版，依原图高清重绘）",
      "file": "samples/cv-hd.webp",
      "source_sha256": "037cbf2df32f8b3b059462e61895eb3bb1a2c56d42780bab8e7bcabb9ab3b0de",
      "renderer": "codex-builtin",
      "date": "2026-10-13",
      "ratio": 2.354
    },
    {
      "topic": "音乐封面",
      "file": "samples/au.webp",
      "renderer": "codex-builtin",
      "date": "2026-10-02",
      "ratio": 1.0
    },
    {
      "topic": "横版插图 第 1 张",
      "file": "samples/wxi.webp",
      "renderer": "codex-builtin",
      "date": "2026-10-02",
      "ratio": 1.776
    },
    {
      "topic": "横版插图 第 2 张",
      "file": "samples/wxi-2.webp",
      "renderer": "codex-builtin",
      "date": "2026-10-02",
      "ratio": 1.776
    },
    {
      "topic": "横版插图 第 3 张",
      "file": "samples/wxi-3.webp",
      "renderer": "codex-builtin",
      "date": "2026-10-02",
      "ratio": 1.776
    },
    {
      "topic": "竖版插图 第 1 张",
      "file": "samples/wxt.webp",
      "renderer": "codex-builtin",
      "date": "2026-10-02",
      "ratio": 0.562
    },
    {
      "topic": "竖版插图 第 2 张",
      "file": "samples/wxt-2.webp",
      "renderer": "codex-builtin",
      "date": "2026-10-02",
      "ratio": 0.562
    },
    {
      "topic": "推特单图",
      "file": "samples/wxx.webp",
      "renderer": "codex-builtin",
      "date": "2026-10-02",
      "ratio": 1.776
    },
    {
      "topic": "四格漫画",
      "file": "samples/cm.webp",
      "renderer": "codex-builtin",
      "date": "2026-10-02",
      "ratio": 1.0
    },
    {
      "topic": "色系·一墨单色·人物场景",
      "file": "samples/pl-mono.webp",
      "renderer": "codex-builtin",
      "date": "2026-10-05",
      "ratio": 0.75
    },
    {
      "topic": "换色示例·原色",
      "file": "samples/pc-orig.webp",
      "renderer": "codex-builtin",
      "date": "2026-10-05",
      "ratio": 1.0
    },
    {
      "topic": "换色示例·桃粉奶霜",
      "file": "samples/pc-macaron.webp",
      "renderer": "codex-builtin",
      "date": "2026-10-05",
      "ratio": 0.75
    },
    {
      "topic": "换色示例·焦糖亚麻",
      "file": "samples/pc-earth.webp",
      "renderer": "codex-builtin",
      "date": "2026-10-05",
      "ratio": 0.75
    },
    {
      "topic": "换色示例·雾灰燕麦",
      "file": "samples/pc-morandi.webp",
      "renderer": "codex-builtin",
      "date": "2026-10-05",
      "ratio": 0.75
    },
    {
      "topic": "换色示例·松林晨雾",
      "file": "samples/pc-forest.webp",
      "renderer": "codex-builtin",
      "date": "2026-10-05",
      "ratio": 0.75
    },
    {
      "topic": "换色示例·海盐浅湾",
      "file": "samples/pc-ocean.webp",
      "renderer": "codex-builtin",
      "date": "2026-10-05",
      "ratio": 0.75
    },
    {
      "topic": "换色示例·旧照暖阳",
      "file": "samples/pc-film.webp",
      "renderer": "codex-builtin",
      "date": "2026-10-05",
      "ratio": 0.75
    },
    {
      "topic": "换色示例·千里青绿",
      "file": "samples/pc-qinglv.webp",
      "renderer": "codex-builtin",
      "date": "2026-10-05",
      "ratio": 0.75
    },
    {
      "topic": "换色示例·朱砂泥金",
      "file": "samples/pc-zhusha.webp",
      "renderer": "codex-builtin",
      "date": "2026-10-05",
      "ratio": 0.75
    },
    {
      "topic": "换色示例·一墨单色",
      "file": "samples/pc-mono.webp",
      "renderer": "codex-builtin",
      "date": "2026-10-05",
      "ratio": 0.75
    },
    {
      "topic": "换色示例·午夜霓虹",
      "file": "samples/pc-neon.webp",
      "renderer": "codex-builtin",
      "date": "2026-10-05",
      "ratio": 0.75
    },
    {
      "topic": "换色示例·日落暖城",
      "file": "samples/pc-sunset.webp",
      "renderer": "codex-builtin",
      "date": "2026-10-05",
      "ratio": 0.75
    },
    {
      "topic": "换色示例·奶油咖啡",
      "file": "samples/pc-creamcoffee.webp",
      "renderer": "codex-builtin",
      "date": "2026-10-05",
      "ratio": 0.75
    },
    {
      "topic": "换色示例·薄荷苏打",
      "file": "samples/pc-mintsoda.webp",
      "renderer": "codex-builtin",
      "date": "2026-10-05",
      "ratio": 0.75
    },
    {
      "topic": "换色示例·湖面晨雾",
      "file": "samples/pc-mistblue.webp",
      "renderer": "codex-builtin",
      "date": "2026-10-05",
      "ratio": 0.75
    },
    {
      "topic": "换色示例·樱花和纸",
      "file": "samples/pc-sakura.webp",
      "renderer": "codex-builtin",
      "date": "2026-10-05",
      "ratio": 0.75
    },
    {
      "topic": "换色示例·靛蓝夜航",
      "file": "samples/pc-indigo.webp",
      "renderer": "codex-builtin",
      "date": "2026-10-05",
      "ratio": 0.75
    },
    {
      "topic": "换色示例·琥珀秋叶",
      "file": "samples/pc-amber.webp",
      "renderer": "codex-builtin",
      "date": "2026-10-05",
      "ratio": 0.75
    },
    {
      "topic": "换色示例·紫藤薄暮",
      "file": "samples/pc-lilac.webp",
      "renderer": "codex-builtin",
      "date": "2026-10-05",
      "ratio": 0.75
    }
  ]
}
